[
  {
    "id": "session-sunny-001",
    "title": "The Sunrise Adventure",
    "body_weather_flags": [
      "sunny",
      "rainbow"
    ],
    "duration_minutes": 15,
    "total_xp": 45,
    "welcome_voice_id": "ignavarr",
    "welcome_clip_id": "welcome.mp3",
    "welcome_category": "welcome",
    "celebration_clip_id": "celebration-1.mp3",
    "celebration_category": "celebration",
    "story": "The morning sun paints the sky gold, and Ignavarr stretches his wings with a yawn. 'Ah, what a magnificent day for adventure! Your Body Weather is shining bright, which means your brain and body are ready for challenges. Today, the movement steward has a strength test, the thinking steward has puzzles, and the creative steward wants to hear your imagination. Let's make this ride legendary!'",
    "deep_objectives": {
      "executive_function": "Sequencing (fist squeeze reps), pattern recognition (2-4-6), working memory (spelling 5 letters), sustained attention across varied activities",
      "social_emotional": "Emotion identification accuracy, empathy perspective-taking, pride in creative expression",
      "sensory": "Proprioceptive input (hand squeezing), interoception (breathing awareness), visual observation (window story)",
      "academic": "Skip counting by 2s, spelling CVC+ words, emotion vocabulary"
    },
    "scaffolding": {
      "if_stuck": "Repeat the question slowly. Give the first hint after 10 seconds.",
      "if_frustrated": "Skip to the next activity. Come back to this one later.",
      "if_dysregulated": "Jump to breathing activity immediately. Weather has shifted."
    },
    "parent_tips": [
      "Ezra is regulated - great time for challenge!",
      "Watch for weather shifts after math activities",
      "Celebrate effort: 'I noticed you thought hard about that one'"
    ],
    "activities": [
      {
        "realm": "adventure-grounds",
        "voice_id": "steward_physical",
        "activity_type": "car_body",
        "narration_clip_id": "movement-stretches.mp3",
        "narration_category": "movement",
        "narration_text": "the movement steward says: Squeeze your hands into fists as tight as you can! Hold it... hold it... now let go! Feel that tingly feeling? Do it three more times!",
        "input_type": "done",
        "xp": 5,
        "sensory_load": 3,
        "ef_demand": 1,
        "deep_target": "Proprioceptive regulation - muscle tension/release cycle activates calming nervous system",
        "correct_answer": "",
        "hints": [],
        "choices": []
      },
      {
        "realm": "thinking-tower",
        "voice_id": "steward_cognitive",
        "activity_type": "math",
        "narration_clip_id": "math-pattern-246.mp3",
        "narration_category": "math",
        "narration_text": "the thinking steward has a puzzle! What comes next: 2, 4, 6, ___?",
        "input_type": "number",
        "xp": 10,
        "sensory_load": 1,
        "ef_demand": 3,
        "deep_target": "Pattern recognition and skip counting - pre-algebraic thinking",
        "correct_answer": "8",
        "hints": [
          "Try counting by twos",
          "What is 6 plus 2?"
        ],
        "choices": []
      },
      {
        "realm": "thinking-tower",
        "voice_id": "steward_cognitive",
        "activity_type": "spelling",
        "narration_clip_id": "spelling-brave.mp3",
        "narration_category": "spelling",
        "narration_text": "Can you spell the word BRAVE? the thinking steward will use it in a sentence: Ezra was very BRAVE today.",
        "input_type": "spelling",
        "xp": 10,
        "sensory_load": 1,
        "ef_demand": 4,
        "deep_target": "Phonemic awareness and letter sequencing - working memory for 5-letter word",
        "correct_answer": "BRAVE",
        "hints": [
          "It starts with B",
          "B-R-A..."
        ],
        "choices": []
      },
      {
        "realm": "sensory-sanctuary",
        "voice_id": "steward_emotional",
        "activity_type": "weather_check",
        "narration_clip_id": "mid-check.mp3",
        "narration_category": "progress",
        "narration_text": "How is your weather now? Has it changed since we started?",
        "input_type": "weather_check",
        "xp": 0,
        "sensory_load": 1,
        "ef_demand": 2,
        "deep_target": "Interoception - recognizing internal state changes after cognitive effort",
        "correct_answer": "",
        "hints": [],
        "choices": []
      },
      {
        "realm": "heart-garden",
        "voice_id": "steward_emotional",
        "activity_type": "emotion",
        "narration_clip_id": "emotion-identify.mp3",
        "narration_category": "emotion",
        "narration_text": "the heart steward shows you a face. What emotion do you see?",
        "input_type": "emotion",
        "xp": 8,
        "sensory_load": 1,
        "ef_demand": 2,
        "deep_target": "Emotion recognition from facial cues - theory of mind foundation",
        "correct_answer": "sad",
        "hints": [],
        "choices": [
          "HAPPY",
          "SAD",
          "ANGRY",
          "SCARED"
        ]
      },
      {
        "realm": "creation-studio",
        "voice_id": "steward_creative",
        "activity_type": "creative",
        "narration_clip_id": "creative-window-story.mp3",
        "narration_category": "creative",
        "narration_text": "the creative steward says: Look out the window! Pick something you see and make up a silly story about it. Tell Dad!",
        "input_type": "done",
        "xp": 7,
        "sensory_load": 2,
        "ef_demand": 3,
        "deep_target": "Narrative generation from visual prompts - language, imagination, shared attention with parent",
        "correct_answer": "",
        "hints": [],
        "choices": []
      },
      {
        "realm": "sensory-sanctuary",
        "voice_id": "steward_emotional",
        "activity_type": "breathing",
        "narration_clip_id": "sensory-breathing.mp3",
        "narration_category": "sensory",
        "narration_text": "Take three deep breaths with the calm steward. Smell the flowers on the way in. Blow out the candles on the way out.",
        "input_type": "breathing",
        "xp": 5,
        "sensory_load": 2,
        "ef_demand": 1,
        "deep_target": "Vagal tone activation - downregulation after cognitive session",
        "correct_answer": "",
        "hints": [],
        "choices": []
      }
    ]
  },
  {
    "id": "session-cloudy-001",
    "title": "Waking Up the Clouds",
    "body_weather_flags": [
      "cloudy"
    ],
    "duration_minutes": 14,
    "total_xp": 40,
    "welcome_voice_id": "ignavarr",
    "welcome_clip_id": "welcome-alt1.mp3",
    "welcome_category": "welcome",
    "celebration_clip_id": "celebration-2.mp3",
    "celebration_category": "celebration",
    "story": "Ignavarr peers through misty clouds. 'Ah, a cloudy day. Your body weather is a bit sleepy, and that is perfectly okay. Today we will gently wake up your brain and body together. the movement steward will get your muscles moving, and then we will see how you feel. No rush. Every cloud holds a hidden rainbow.'",
    "deep_objectives": {
      "executive_function": "Gentle activation - isometric exercises to increase arousal, basic addition to engage without overwhelming",
      "social_emotional": "Emotional expression through faces, creative self-expression, acceptance of low-energy states",
      "sensory": "Heavy work (hand push), proprioceptive activation (wiggle/scrunch), breathing for regulation",
      "academic": "Single-digit addition with concrete context, verbal expression"
    },
    "scaffolding": {
      "if_stuck": "Simplify - offer two choices instead of open-ended. 'Is it 4 or 5?'",
      "if_frustrated": "Switch to creative or sensory activity. Cloudy days need gentleness.",
      "if_dysregulated": "Stop all cognitive tasks. Go to breathing. Stay there as long as needed."
    },
    "parent_tips": [
      "Cloudy weather needs gentle activation",
      "Keep cognitive demands lighter today",
      "A crunchy snack or cold drink can help activate"
    ],
    "activities": [
      {
        "realm": "adventure-grounds",
        "voice_id": "steward_physical",
        "activity_type": "car_body",
        "narration_clip_id": "movement-stretches.mp3",
        "narration_category": "movement",
        "narration_text": "the movement steward says: Push your hands together as hard as you can! Feel your muscles working? Hold for five seconds... and release! Two more times!",
        "input_type": "done",
        "xp": 5,
        "sensory_load": 4,
        "ef_demand": 1,
        "deep_target": "Isometric heavy work - proprioceptive input to increase alertness from low-arousal state",
        "correct_answer": "",
        "hints": [],
        "choices": []
      },
      {
        "realm": "adventure-grounds",
        "voice_id": "steward_physical",
        "activity_type": "car_body",
        "narration_clip_id": "movement-balance.mp3",
        "narration_category": "movement",
        "narration_text": "Wiggle your fingers fast as you can! Now wiggle your toes inside your shoes! Now scrunch up your whole face tight... and let go! Big silly face!",
        "input_type": "done",
        "xp": 5,
        "sensory_load": 3,
        "ef_demand": 1,
        "deep_target": "Bilateral motor activation - sequential body part awareness for arousal",
        "correct_answer": "",
        "hints": [],
        "choices": []
      },
      {
        "realm": "thinking-tower",
        "voice_id": "steward_cognitive",
        "activity_type": "math",
        "narration_clip_id": "math-addition-3plus2.mp3",
        "narration_category": "math",
        "narration_text": "If you have three apples and Dad gives you two more, how many apples do you have?",
        "input_type": "number",
        "xp": 8,
        "sensory_load": 1,
        "ef_demand": 2,